{
  "schema_version": "wednesday.docs.runtime_corpus.v1",
  "corpus_id": "wednesday-public-docs",
  "canonical_origin": "https://docs.wednesdaychat.com",
  "language": "en",
  "corpus_hash": "8a24194c4993988416115738810c4b76ffd818671306715ccd33b7bb97f10d04",
  "chunk_count": 146,
  "chunks": [
    {
      "id": "agents.overview",
      "title": "Agents",
      "section": "Overview",
      "url": "https://docs.wednesdaychat.com/agents/",
      "content": "WEDNESDAY agent behavior is built from stateful turns, typed tool activity, durable task state, and explicit user control rather than a hidden autonomous loop.",
      "content_hash": "c1055894026278d2ac7e16265434f71e096da5f0d6c9ee5ff7217cf0d5d8f71f",
      "tags": [
        "agents"
      ],
      "lifecycle": "stable",
      "source_path": "agents/index.md",
      "ordinal": 0
    },
    {
      "id": "agents.stateful-execution",
      "title": "Agents",
      "section": "Stateful execution",
      "url": "https://docs.wednesdaychat.com/agents/#stateful-execution",
      "content": "A turn belongs to authenticated durable conversation state. Project context can be loaded for the conversation before execution and rendered into the system context supplied to the turn.",
      "content_hash": "65f395f59f7bb62cbc5a86064986a98d1de6fd3bcb8beca098ad41fceadda787",
      "tags": [
        "agents"
      ],
      "lifecycle": "stable",
      "source_path": "agents/index.md",
      "ordinal": 1
    },
    {
      "id": "agents.observable-activity",
      "title": "Agents",
      "section": "Observable activity",
      "url": "https://docs.wednesdaychat.com/agents/#observable-activity",
      "content": "The stream protocol has distinct activity and tool event families. Tool execution can report start, progress, state transitions, and completion rather than collapsing all tool work into opaque text.",
      "content_hash": "2ed208f5790f6e081c8dbaca0610609bb0938ff8ca6aa095db8ffea8111c1e04",
      "tags": [
        "agents"
      ],
      "lifecycle": "stable",
      "source_path": "agents/index.md",
      "ordinal": 2
    },
    {
      "id": "agents.steering-and-cancellation",
      "title": "Agents",
      "section": "Steering and cancellation",
      "url": "https://docs.wednesdaychat.com/agents/#steering-and-cancellation",
      "content": "Supported turns can accept mid-turn steering while the acceptance window remains open. Durable research tasks have an explicit cancellation route.",
      "content_hash": "a2fe3d039b291b214de9e7d3a72c01089f8cf6b93612df74f23e4e56649b874b",
      "tags": [
        "agents"
      ],
      "lifecycle": "stable",
      "source_path": "agents/index.md",
      "ordinal": 3
    },
    {
      "id": "agents.approval-aware-behavior",
      "title": "Agents",
      "section": "Approval-aware behavior",
      "url": "https://docs.wednesdaychat.com/agents/#approval-aware-behavior",
      "content": "The execution protocol models approval risk and reversibility as explicit concepts. Public documentation will describe concrete approval flows only when the corresponding user/developer contract is stable.",
      "content_hash": "7798dfcefb0beda3771186116f05dca2c7ecd1bfca947cdb167d6d3b8ea59ef8",
      "tags": [
        "agents"
      ],
      "lifecycle": "stable",
      "source_path": "agents/index.md",
      "ordinal": 4
    },
    {
      "id": "agents.agent-boundary",
      "title": "Agents",
      "section": "Agent boundary",
      "url": "https://docs.wednesdaychat.com/agents/#agent-boundary",
      "content": "An agent may use tools and durable state, but authorization remains server-owned. Agent execution does not bypass the account session, project ownership, file ownership, connector scope, or external-write approval boundaries.",
      "content_hash": "c444554325e0d3258c7d58c4c36b87b830b4e7019158e5c6f1d61bd2550798b0",
      "tags": [
        "agents"
      ],
      "lifecycle": "stable",
      "source_path": "agents/index.md",
      "ordinal": 5
    },
    {
      "id": "api.authentication.overview",
      "title": "Authentication",
      "section": "Overview",
      "url": "https://docs.wednesdaychat.com/api/authentication/",
      "content": "WEDNESDAY production requests are authorized through the account session boundary used by the WEDNESDAY product. Durable ownership is derived server-side from that authorized session.",
      "content_hash": "0bbd9fad57260b8c23fdd2761b088fa15d290b9f17d636e6abf4ef5b3cb9baca",
      "tags": [
        "api",
        "authentication"
      ],
      "lifecycle": "stable",
      "source_path": "api/authentication/index.md",
      "ordinal": 0
    },
    {
      "id": "api.authentication.account-authority",
      "title": "Authentication",
      "section": "Account authority",
      "url": "https://docs.wednesdaychat.com/api/authentication/#account-authority",
      "content": "For protected operations, the API resolves the account owner from the authorized server session rather than trusting a caller-supplied owner identifier. This keeps projects, conversations, files, search results, and durable chat state scoped to the authenticated account.",
      "content_hash": "4e1cd557ab82396c9afc246179b0db87ddede7c784f4826e9484f314731b946d",
      "tags": [
        "api",
        "authentication"
      ],
      "lifecycle": "stable",
      "source_path": "api/authentication/index.md",
      "ordinal": 1
    },
    {
      "id": "api.authentication.browser-requests",
      "title": "Authentication",
      "section": "Browser requests",
      "url": "https://docs.wednesdaychat.com/api/authentication/#browser-requests",
      "content": "The production web application communicates with https://api.wednesdaychat.com using the WEDNESDAY session boundary. Cross-origin access is restricted to approved WEDNESDAY origins and explicitly allowed methods and headers.",
      "content_hash": "56c82f1a7562e17bb06cf457737c168893b83e9e3094a8403d0294c5251e6ff8",
      "tags": [
        "api",
        "authentication"
      ],
      "lifecycle": "stable",
      "source_path": "api/authentication/index.md",
      "ordinal": 2
    },
    {
      "id": "api.authentication.request-headers",
      "title": "Authentication",
      "section": "Request headers",
      "url": "https://docs.wednesdaychat.com/api/authentication/#request-headers",
      "content": "Some production flows use WEDNESDAY-specific headers for session continuity, CSRF protection, client identity, idempotency, or turn coordination. A header appearing in the service implementation does not by itself make it a public third-party authentication mechanism.",
      "content_hash": "dc083f8a2b6f8433beb97f0efb9b2fe3097a0b79ffdcbf577666e732fc5b0769",
      "tags": [
        "api",
        "authentication"
      ],
      "lifecycle": "stable",
      "source_path": "api/authentication/index.md",
      "ordinal": 3
    },
    {
      "id": "api.authentication.third-party-developer-access",
      "title": "Authentication",
      "section": "Third-party developer access",
      "url": "https://docs.wednesdaychat.com/api/authentication/#third-party-developer-access",
      "content": "No implied API-key program. WEDNESDAY does not document a general public API-key authentication contract until that contract is explicitly released. Do not attempt to synthesize account/session headers or rely on internal browser-session behavior from an external integration.",
      "content_hash": "3bc96d84e469555419a2f8f8d0a7b39633eee5a6318091e9d686cd23d4f0645e",
      "tags": [
        "api",
        "authentication"
      ],
      "lifecycle": "stable",
      "source_path": "api/authentication/index.md",
      "ordinal": 4
    },
    {
      "id": "api.authentication.authorization-failures",
      "title": "Authentication",
      "section": "Authorization failures",
      "url": "https://docs.wednesdaychat.com/api/authentication/#authorization-failures",
      "content": "Callers should treat authorization and session failures as terminal for the current credential context and re-establish a valid WEDNESDAY session through the supported product flow rather than retrying with fabricated identity data.",
      "content_hash": "f05a2f3968df7935a23ef2fb6ef0e99c679120182d3dba3406ffa128982d1439",
      "tags": [
        "api",
        "authentication"
      ],
      "lifecycle": "stable",
      "source_path": "api/authentication/index.md",
      "ordinal": 5
    },
    {
      "id": "api.errors.overview",
      "title": "Errors",
      "section": "Overview",
      "url": "https://docs.wednesdaychat.com/api/errors/",
      "content": "WEDNESDAY uses standard HTTP status codes plus concise error detail strings. Clients should branch on status and documented semantics rather than parsing incidental implementation text.",
      "content_hash": "210a19f97e94c051c103a9263f5a16278a9531b6f70f3797aeee65037cc1e5bf",
      "tags": [
        "api",
        "errors"
      ],
      "lifecycle": "stable",
      "source_path": "api/errors/index.md",
      "ordinal": 0
    },
    {
      "id": "api.errors.common-status-codes",
      "title": "Errors",
      "section": "Common status codes",
      "url": "https://docs.wednesdaychat.com/api/errors/#common-status-codes",
      "content": "| Status | Meaning |\n| --- | --- |\n| 400 | Invalid request shape or transport constraint. |\n| 404 | Requested account-owned resource or share target was not found. |\n| 409 | The requested state transition conflicts with current durable state. |\n| 410 | A time-bounded resource, such as an upload session, has expired. |\n| 413 | A request body exceeds the accepted size. |\n| 415 | An uploaded media type or content representation is unsupported. |\n| 422 | A validated parameter or identifier is semantically invalid. |\n| 429 | A rate limit was exceeded. Respect Retry-After when supplied. |\n| 503 | A required WEDNESDAY dependency or protection layer is unavailable. |",